1	0.000000	192.168.1.164	142.104.5.64	TCP	62	1200 → 80 [SYN] Seq=2187554249 Win=16384 Len=0 MSS=1460 SACK_PERM
2	0.002812	142.104.5.64	192.168.1.164	TCP	60	80 → 1200 [SYN, ACK] Seq=625910336 Ack=2187554250 Win=17520 Len=0 MSS=1460
3	0.002835	192.168.1.164	142.104.5.64	TCP	54	1200 → 80 [ACK] Seq=2187554250 Ack=625910337 Win=17520 Len=0
4	0.002916	192.168.1.164	142.104.5.64	HTTP	473	GET /index.html HTTP/1.1 
5	0.015346	142.104.5.64	192.168.1.164	TCP	1514	80 → 1200 [ACK] Seq=625910337 Ack=2187554669 Win=17520 Len=1460 [TCP PDU reassembled in 20]
6	0.016755	142.104.5.64	192.168.1.164	TCP	1514	80 → 1200 [ACK] Seq=625911797 Ack=2187554669 Win=17520 Len=1460 [TCP PDU reassembled in 20]
7	0.016776	192.168.1.164	142.104.5.64	TCP	54	1200 → 80 [ACK] Seq=2187554669 Ack=625913257 Win=17520 Len=0
8	0.018250	142.104.5.64	192.168.1.164	TCP	1514	80 → 1200 [ACK] Seq=625913257 Ack=2187554669 Win=17520 Len=1460 [TCP PDU reassembled in 20]
9	0.025730	142.104.5.64	192.168.1.164	TCP	1514	80 → 1200 [ACK] Seq=625914717 Ack=2187554669 Win=17520 Len=1460 [TCP PDU reassembled in 20]
10	0.025753	192.168.1.164	142.104.5.64	TCP	54	1200 → 80 [ACK] Seq=2187554669 Ack=625916177 Win=17520 Len=0
11	0.027093	142.104.5.64	192.168.1.164	TCP	1514	80 → 1200 [ACK] Seq=625916177 Ack=2187554669 Win=17520 Len=1460 [TCP PDU reassembled in 20]
12	0.030109	142.104.5.64	192.168.1.164	TCP	1514	80 → 1200 [ACK] Seq=625917637 Ack=2187554669 Win=17520 Len=1460 [TCP PDU reassembled in 20]
13	0.030129	192.168.1.164	142.104.5.64	TCP	54	1200 → 80 [ACK] Seq=2187554669 Ack=625919097 Win=17520 Len=0
14	0.034411	142.104.5.64	192.168.1.164	TCP	1514	80 → 1200 [ACK] Seq=625919097 Ack=2187554669 Win=17520 Len=1460 [TCP PDU reassembled in 20]
15	0.034432	192.168.1.164	142.104.5.64	TCP	54	1200 → 80 [ACK] Seq=2187554669 Ack=625920557 Win=16060 Len=0
16	0.035788	142.104.5.64	192.168.1.164	TCP	1514	80 → 1200 [ACK] Seq=625920557 Ack=2187554669 Win=17520 Len=1460 [TCP PDU reassembled in 20]
17	0.037570	142.104.5.64	192.168.1.164	TCP	1514	80 → 1200 [ACK] Seq=625922017 Ack=2187554669 Win=17520 Len=1460 [TCP PDU reassembled in 20]
18	0.037583	192.168.1.164	142.104.5.64	TCP	54	1200 → 80 [ACK] Seq=2187554669 Ack=625923477 Win=13140 Len=0
19	0.039063	142.104.5.64	192.168.1.164	TCP	1514	80 → 1200 [ACK] Seq=625923477 Ack=2187554669 Win=17520 Len=1460 [TCP PDU reassembled in 20]
20	0.040795	142.104.5.64	192.168.1.164	HTTP	1426	HTTP/1.1 200 OK  (text/html)
21	0.040811	192.168.1.164	142.104.5.64	TCP	54	1200 → 80 [ACK] Seq=2187554669 Ack=625926309 Win=10308 Len=0
22	0.291372	192.168.1.164	142.104.5.64	TCP	54	[TCP Window Update] 1200 → 80 [ACK] Seq=2187554669 Ack=625926309 Win=17520 Len=0
23	2.607847	192.168.1.164	142.104.5.64	HTTP	491	GET /about/welcome.html HTTP/1.1 
24	2.632146	142.104.5.64	192.168.1.164	TCP	1514	80 → 1200 [ACK] Seq=625926309 Ack=2187555106 Win=17520 Len=1460 [TCP PDU reassembled in 42]
25	2.633580	142.104.5.64	192.168.1.164	TCP	1514	80 → 1200 [ACK] Seq=625927769 Ack=2187555106 Win=17520 Len=1460 [TCP PDU reassembled in 42]
26	2.633599	192.168.1.164	142.104.5.64	TCP	54	1200 → 80 [ACK] Seq=2187555106 Ack=625929229 Win=17520 Len=0
27	2.635054	142.104.5.64	192.168.1.164	TCP	1514	80 → 1200 [ACK] Seq=625929229 Ack=2187555106 Win=17520 Len=1460 [TCP PDU reassembled in 42]
28	2.636436	142.104.5.64	192.168.1.164	TCP	1514	80 → 1200 [ACK] Seq=625930689 Ack=2187555106 Win=17520 Len=1460 [TCP PDU reassembled in 42]
29	2.636450	192.168.1.164	142.104.5.64	TCP	54	1200 → 80 [ACK] Seq=2187555106 Ack=625932149 Win=17520 Len=0
30	2.638154	142.104.5.64	192.168.1.164	TCP	1514	80 → 1200 [ACK] Seq=625932149 Ack=2187555106 Win=17520 Len=1460 [TCP PDU reassembled in 42]
31	2.639974	142.104.5.64	192.168.1.164	TCP	1514	80 → 1200 [ACK] Seq=625933609 Ack=2187555106 Win=17520 Len=1460 [TCP PDU reassembled in 42]
32	2.639988	192.168.1.164	142.104.5.64	TCP	54	1200 → 80 [ACK] Seq=2187555106 Ack=625935069 Win=17520 Len=0
33	2.641453	142.104.5.64	192.168.1.164	TCP	1514	80 → 1200 [ACK] Seq=625935069 Ack=2187555106 Win=17520 Len=1460 [TCP PDU reassembled in 42]
34	2.641471	192.168.1.164	142.104.5.64	TCP	54	1200 → 80 [ACK] Seq=2187555106 Ack=625936529 Win=16060 Len=0
35	2.643176	142.104.5.64	192.168.1.164	TCP	1514	80 → 1200 [ACK] Seq=625936529 Ack=2187555106 Win=17520 Len=1460 [TCP PDU reassembled in 42]
36	2.644653	142.104.5.64	192.168.1.164	TCP	1514	80 → 1200 [ACK] Seq=625937989 Ack=2187555106 Win=17520 Len=1460 [TCP PDU reassembled in 42]
37	2.644666	192.168.1.164	142.104.5.64	TCP	54	1200 → 80 [ACK] Seq=2187555106 Ack=625939449 Win=13140 Len=0
38	2.653198	192.168.1.164	142.104.5.64	TCP	54	[TCP Window Update] 1200 → 80 [ACK] Seq=2187555106 Ack=625939449 Win=17520 Len=0
39	2.654450	142.104.5.64	192.168.1.164	TCP	1514	80 → 1200 [ACK] Seq=625939449 Ack=2187555106 Win=17520 Len=1460 [TCP PDU reassembled in 42]
40	2.658101	142.104.5.64	192.168.1.164	TCP	1514	80 → 1200 [ACK] Seq=625940909 Ack=2187555106 Win=17520 Len=1460 [TCP PDU reassembled in 42]
41	2.658127	192.168.1.164	142.104.5.64	TCP	54	1200 → 80 [ACK] Seq=2187555106 Ack=625942369 Win=17520 Len=0
42	2.659628	142.104.5.64	192.168.1.164	HTTP	544	HTTP/1.1 200 OK  (text/html)
43	2.669554	192.168.1.164	142.104.5.64	TCP	62	1201 → 80 [SYN] Seq=2321443539 Win=16384 Len=0 MSS=1460 SACK_PERM
44	2.682610	142.104.5.64	192.168.1.164	TCP	60	80 → 1201 [SYN, ACK] Seq=2819811382 Ack=2321443540 Win=17520 Len=0 MSS=1460
45	2.682672	192.168.1.164	142.104.5.64	TCP	54	1201 → 80 [ACK] Seq=2321443540 Ack=2819811383 Win=17520 Len=0
46	2.682800	192.168.1.164	142.104.5.64	HTTP	347	GET /assets/photos/president.jpg HTTP/1.1 
47	2.695080	142.104.5.64	192.168.1.164	TCP	1514	80 → 1201 [ACK] Seq=2819811383 Ack=2321443833 Win=17520 Len=1460 [TCP PDU reassembled in 69]
48	2.696407	142.104.5.64	192.168.1.164	TCP	1514	80 → 1201 [ACK] Seq=2819812843 Ack=2321443833 Win=17520 Len=1460 [TCP PDU reassembled in 69]
49	2.696432	192.168.1.164	142.104.5.64	TCP	54	1201 → 80 [ACK] Seq=2321443833 Ack=2819814303 Win=17520 Len=0
50	2.697782	142.104.5.64	192.168.1.164	TCP	1514	80 → 1201 [ACK] Seq=2819814303 Ack=2321443833 Win=17520 Len=1460 [TCP PDU reassembled in 69]
51	2.705228	142.104.5.64	192.168.1.164	TCP	1514	80 → 1201 [ACK] Seq=2819815763 Ack=2321443833 Win=17520 Len=1460 [TCP PDU reassembled in 69]
52	2.705273	192.168.1.164	142.104.5.64	TCP	54	1201 → 80 [ACK] Seq=2321443833 Ack=2819817223 Win=17520 Len=0
53	2.706019	192.168.1.164	142.104.5.64	HTTP	340	GET /assets/images/up.gif HTTP/1.1 
54	2.706712	142.104.5.64	192.168.1.164	TCP	1514	80 → 1201 [ACK] Seq=2819817223 Ack=2321443833 Win=17520 Len=1460 [TCP PDU reassembled in 69]
55	2.708483	142.104.5.64	192.168.1.164	TCP	1514	80 → 1201 [ACK] Seq=2819818683 Ack=2321443833 Win=17520 Len=1460 [TCP PDU reassembled in 69]
56	2.708504	192.168.1.164	142.104.5.64	TCP	54	1201 → 80 [ACK] Seq=2321443833 Ack=2819820143 Win=17520 Len=0
57	2.714155	142.104.5.64	192.168.1.164	TCP	1514	80 → 1201 [ACK] Seq=2819820143 Ack=2321443833 Win=17520 Len=1460 [TCP PDU reassembled in 69]
58	2.715583	142.104.5.64	192.168.1.164	TCP	1514	80 → 1201 [ACK] Seq=2819821603 Ack=2321443833 Win=17520 Len=1460 [TCP PDU reassembled in 69]
59	2.715607	192.168.1.164	142.104.5.64	TCP	54	1201 → 80 [ACK] Seq=2321443833 Ack=2819823063 Win=17520 Len=0
60	2.717024	142.104.5.64	192.168.1.164	TCP	1514	80 → 1201 [ACK] Seq=2819823063 Ack=2321443833 Win=17520 Len=1460 [TCP PDU reassembled in 69]
61	2.719236	142.104.5.64	192.168.1.164	TCP	1514	80 → 1201 [ACK] Seq=2819824523 Ack=2321443833 Win=17520 Len=1460 [TCP PDU reassembled in 69]
62	2.719262	192.168.1.164	142.104.5.64	TCP	54	1201 → 80 [ACK] Seq=2321443833 Ack=2819825983 Win=17520 Len=0
63	2.720672	142.104.5.64	192.168.1.164	TCP	1514	80 → 1201 [ACK] Seq=2819825983 Ack=2321443833 Win=17520 Len=1460 [TCP PDU reassembled in 69]
64	2.722483	142.104.5.64	192.168.1.164	TCP	1514	80 → 1201 [ACK] Seq=2819827443 Ack=2321443833 Win=17520 Len=1460 [TCP PDU reassembled in 69]
65	2.722567	192.168.1.164	142.104.5.64	TCP	54	1201 → 80 [ACK] Seq=2321443833 Ack=2819828903 Win=17520 Len=0
66	2.723123	142.104.5.64	192.168.1.164	HTTP	453	HTTP/1.1 200 OK  (GIF89a)
67	2.725364	192.168.1.164	142.104.5.64	HTTP	344	GET /assets/images/bullet.gif HTTP/1.1 
68	2.730159	142.104.5.64	192.168.1.164	TCP	1514	80 → 1201 [ACK] Seq=2819828903 Ack=2321443833 Win=17520 Len=1460 [TCP PDU reassembled in 69]
69	2.732155	142.104.5.64	192.168.1.164	HTTP	816	HTTP/1.1 200 OK  (JPEG JFIF image)
70	2.732204	192.168.1.164	142.104.5.64	TCP	54	1201 → 80 [ACK] Seq=2321443833 Ack=2819831125 Win=17520 Len=0
71	2.756852	142.104.5.64	192.168.1.164	TCP	60	80 → 1200 [ACK] Seq=625943258 Ack=2187555682 Win=17230 Len=0
72	2.791051	142.104.5.64	192.168.1.164	HTTP	391	HTTP/1.1 200 OK  (GIF89a)
73	2.923682	192.168.1.164	142.104.5.64	TCP	54	1200 → 80 [ACK] Seq=2187555682 Ack=625943595 Win=16294 Len=0
74	6.335747	192.168.1.164	142.104.5.64	HTTP	497	GET /staff/index.html HTTP/1.1 
75	6.348416	142.104.5.64	192.168.1.164	TCP	1514	80 → 1201 [ACK] Seq=2819831125 Ack=2321444276 Win=17520 Len=1460 [TCP PDU reassembled in 102]
76	6.349822	142.104.5.64	192.168.1.164	TCP	1514	80 → 1201 [ACK] Seq=2819832585 Ack=2321444276 Win=17520 Len=1460 [TCP PDU reassembled in 102]
77	6.349845	192.168.1.164	142.104.5.64	TCP	54	1201 → 80 [ACK] Seq=2321444276 Ack=2819834045 Win=17520 Len=0
78	6.351262	142.104.5.64	192.168.1.164	TCP	1514	80 → 1201 [ACK] Seq=2819834045 Ack=2321444276 Win=17520 Len=1460 [TCP PDU reassembled in 102]
79	6.353071	142.104.5.64	192.168.1.164	TCP	1514	80 → 1201 [ACK] Seq=2819835505 Ack=2321444276 Win=17520 Len=1460 [TCP PDU reassembled in 102]
80	6.353105	192.168.1.164	142.104.5.64	TCP	54	1201 → 80 [ACK] Seq=2321444276 Ack=2819836965 Win=17520 Len=0
81	6.354494	142.104.5.64	192.168.1.164	TCP	1514	80 → 1201 [ACK] Seq=2819836965 Ack=2321444276 Win=17520 Len=1460 [TCP PDU reassembled in 102]
82	6.356325	142.104.5.64	192.168.1.164	TCP	1514	80 → 1201 [ACK] Seq=2819838425 Ack=2321444276 Win=17520 Len=1460 [TCP PDU reassembled in 102]
83	6.356357	192.168.1.164	142.104.5.64	TCP	54	1201 → 80 [ACK] Seq=2321444276 Ack=2819839885 Win=17520 Len=0
84	6.357701	142.104.5.64	192.168.1.164	TCP	1514	80 → 1201 [ACK] Seq=2819839885 Ack=2321444276 Win=17520 Len=1460 [TCP PDU reassembled in 102]
85	6.359442	142.104.5.64	192.168.1.164	TCP	1514	80 → 1201 [ACK] Seq=2819841345 Ack=2321444276 Win=17520 Len=1460 [TCP PDU reassembled in 102]
86	6.359469	192.168.1.164	142.104.5.64	TCP	54	1201 → 80 [ACK] Seq=2321444276 Ack=2819842805 Win=17520 Len=0
87	6.360858	142.104.5.64	192.168.1.164	TCP	1514	80 → 1201 [ACK] Seq=2819842805 Ack=2321444276 Win=17520 Len=1460 [TCP PDU reassembled in 102]
88	6.362605	142.104.5.64	192.168.1.164	TCP	1514	80 → 1201 [ACK] Seq=2819844265 Ack=2321444276 Win=17520 Len=1460 [TCP PDU reassembled in 102]
89	6.362632	192.168.1.164	142.104.5.64	TCP	54	1201 → 80 [ACK] Seq=2321444276 Ack=2819845725 Win=17520 Len=0
90	6.364021	142.104.5.64	192.168.1.164	TCP	1514	80 → 1201 [ACK] Seq=2819845725 Ack=2321444276 Win=17520 Len=1460 [TCP PDU reassembled in 102]
91	6.364054	192.168.1.164	142.104.5.64	TCP	54	1201 → 80 [ACK] Seq=2321444276 Ack=2819847185 Win=17520 Len=0
92	6.365789	142.104.5.64	192.168.1.164	TCP	1514	80 → 1201 [PSH, ACK] Seq=2819847185 Ack=2321444276 Win=17520 Len=1460 [TCP PDU reassembled in 102]
93	6.368398	192.168.1.164	142.104.5.64	HTTP	354	GET /assets/headerphotos/staff-banner.jpg HTTP/1.1 
94	6.369903	142.104.5.64	192.168.1.164	TCP	1514	80 → 1201 [ACK] Seq=2819848645 Ack=2321444276 Win=17520 Len=1460 [TCP PDU reassembled in 102]
95	6.369927	192.168.1.164	142.104.5.64	TCP	54	1201 → 80 [ACK] Seq=2321444276 Ack=2819850105 Win=17520 Len=0
96	6.371931	142.104.5.64	192.168.1.164	TCP	1514	80 → 1201 [ACK] Seq=2819850105 Ack=2321444276 Win=17520 Len=1460 [TCP PDU reassembled in 102]
97	6.373693	142.104.5.64	192.168.1.164	TCP	1514	80 → 1201 [ACK] Seq=2819851565 Ack=2321444276 Win=17520 Len=1460 [TCP PDU reassembled in 102]
98	6.373714	192.168.1.164	142.104.5.64	TCP	54	1201 → 80 [ACK] Seq=2321444276 Ack=2819853025 Win=17520 Len=0
99	6.375121	142.104.5.64	192.168.1.164	TCP	1514	80 → 1201 [ACK] Seq=2819853025 Ack=2321444276 Win=17520 Len=1460 [TCP PDU reassembled in 102]
100	6.376856	142.104.5.64	192.168.1.164	TCP	1514	80 → 1201 [ACK] Seq=2819854485 Ack=2321444276 Win=17520 Len=1460 [TCP PDU reassembled in 102]
101	6.376879	192.168.1.164	142.104.5.64	TCP	54	1201 → 80 [ACK] Seq=2321444276 Ack=2819855945 Win=17520 Len=0
102	6.378002	142.104.5.64	192.168.1.164	HTTP	1078	HTTP/1.1 200 OK  (text/html)
103	6.382278	142.104.5.64	192.168.1.164	TCP	1514	80 → 1200 [ACK] Seq=625943595 Ack=2187555982 Win=17520 Len=1460 [TCP PDU reassembled in 112]
104	6.383756	142.104.5.64	192.168.1.164	TCP	1514	80 → 1200 [ACK] Seq=625945055 Ack=2187555982 Win=17520 Len=1460 [TCP PDU reassembled in 112]
105	6.383777	192.168.1.164	142.104.5.64	TCP	54	1200 → 80 [ACK] Seq=2187555982 Ack=625946515 Win=17520 Len=0
106	6.385203	142.104.5.64	192.168.1.164	TCP	1514	80 → 1200 [ACK] Seq=625946515 Ack=2187555982 Win=17520 Len=1460 [TCP PDU reassembled in 112]
107	6.386964	142.104.5.64	192.168.1.164	TCP	1514	80 → 1200 [ACK] Seq=625947975 Ack=2187555982 Win=17520 Len=1460 [TCP PDU reassembled in 112]
108	6.386990	192.168.1.164	142.104.5.64	TCP	54	1200 → 80 [ACK] Seq=2187555982 Ack=625949435 Win=17520 Len=0
109	6.388367	142.104.5.64	192.168.1.164	TCP	1514	80 → 1200 [ACK] Seq=625949435 Ack=2187555982 Win=17520 Len=1460 [TCP PDU reassembled in 112]
110	6.390111	142.104.5.64	192.168.1.164	TCP	1514	80 → 1200 [ACK] Seq=625950895 Ack=2187555982 Win=17520 Len=1460 [TCP PDU reassembled in 112]
111	6.390137	192.168.1.164	142.104.5.64	TCP	54	1200 → 80 [ACK] Seq=2187555982 Ack=625952355 Win=17520 Len=0
112	6.391000	142.104.5.64	192.168.1.164	HTTP	740	HTTP/1.1 200 OK  (JPEG JFIF image)
113	6.421515	192.168.1.164	142.104.5.64	HTTP	344	GET /assets/images/grey-bar.gif HTTP/1.1 
114	6.429602	142.104.5.64	192.168.1.164	HTTP	630	HTTP/1.1 200 OK  (GIF89a)
115	6.528564	192.168.1.164	142.104.5.64	TCP	54	1200 → 80 [ACK] Seq=2187555982 Ack=625953041 Win=16834 Len=0
116	6.628682	192.168.1.164	142.104.5.64	TCP	54	1201 → 80 [ACK] Seq=2321444566 Ack=2819857545 Win=17520 Len=0
117	10.127886	192.168.1.164	142.104.5.64	HTTP	498	GET /academic/index.html HTTP/1.1 
118	10.146296	142.104.5.64	192.168.1.164	TCP	1514	80 → 1200 [ACK] Seq=625953041 Ack=2187556426 Win=17520 Len=1460 [TCP PDU reassembled in 137]
119	10.148416	142.104.5.64	192.168.1.164	TCP	1514	80 → 1200 [ACK] Seq=625954501 Ack=2187556426 Win=17520 Len=1460 [TCP PDU reassembled in 137]
120	10.148449	192.168.1.164	142.104.5.64	TCP	54	1200 → 80 [ACK] Seq=2187556426 Ack=625955961 Win=17520 Len=0
121	10.149881	142.104.5.64	192.168.1.164	TCP	1514	80 → 1200 [ACK] Seq=625955961 Ack=2187556426 Win=17520 Len=1460 [TCP PDU reassembled in 137]
122	10.151705	142.104.5.64	192.168.1.164	TCP	1514	80 → 1200 [ACK] Seq=625957421 Ack=2187556426 Win=17520 Len=1460 [TCP PDU reassembled in 137]
123	10.151734	192.168.1.164	142.104.5.64	TCP	54	1200 → 80 [ACK] Seq=2187556426 Ack=625958881 Win=17520 Len=0
124	10.153123	142.104.5.64	192.168.1.164	TCP	1514	80 → 1200 [ACK] Seq=625958881 Ack=2187556426 Win=17520 Len=1460 [TCP PDU reassembled in 137]
125	10.155006	142.104.5.64	192.168.1.164	TCP	1514	80 → 1200 [ACK] Seq=625960341 Ack=2187556426 Win=17520 Len=1460 [TCP PDU reassembled in 137]
126	10.155035	192.168.1.164	142.104.5.64	TCP	54	1200 → 80 [ACK] Seq=2187556426 Ack=625961801 Win=17520 Len=0
127	10.157862	142.104.5.64	192.168.1.164	TCP	1514	80 → 1200 [ACK] Seq=625961801 Ack=2187556426 Win=17520 Len=1460 [TCP PDU reassembled in 137]
128	10.160256	142.104.5.64	192.168.1.164	TCP	1514	80 → 1200 [ACK] Seq=625963261 Ack=2187556426 Win=17520 Len=1460 [TCP PDU reassembled in 137]
129	10.160292	192.168.1.164	142.104.5.64	TCP	54	1200 → 80 [ACK] Seq=2187556426 Ack=625964721 Win=17520 Len=0
130	10.162768	142.104.5.64	192.168.1.164	TCP	1514	80 → 1200 [ACK] Seq=625964721 Ack=2187556426 Win=17520 Len=1460 [TCP PDU reassembled in 137]
131	10.164268	142.104.5.64	192.168.1.164	TCP	1514	80 → 1200 [ACK] Seq=625966181 Ack=2187556426 Win=17520 Len=1460 [TCP PDU reassembled in 137]
132	10.164290	192.168.1.164	142.104.5.64	TCP	54	1200 → 80 [ACK] Seq=2187556426 Ack=625967641 Win=17520 Len=0
133	10.165682	142.104.5.64	192.168.1.164	TCP	1514	80 → 1200 [ACK] Seq=625967641 Ack=2187556426 Win=17520 Len=1460 [TCP PDU reassembled in 137]
134	10.167034	192.168.1.164	142.104.5.64	HTTP	362	GET /assets/sectionheader-photos/faculties.jpg HTTP/1.1 
135	10.167507	142.104.5.64	192.168.1.164	TCP	1514	80 → 1200 [PSH, ACK] Seq=625969101 Ack=2187556426 Win=17520 Len=1460 [TCP PDU reassembled in 137]
136	10.167524	192.168.1.164	142.104.5.64	TCP	54	1200 → 80 [ACK] Seq=2187556426 Ack=625970561 Win=17520 Len=0
137	10.169855	142.104.5.64	192.168.1.164	HTTP	787	HTTP/1.1 200 OK  (text/html)
138	10.200026	142.104.5.64	192.168.1.164	TCP	1514	80 → 1201 [ACK] Seq=2819857545 Ack=2321444874 Win=17520 Len=1460 [TCP PDU reassembled in 144]
139	10.202600	142.104.5.64	192.168.1.164	TCP	1514	80 → 1201 [ACK] Seq=2819859005 Ack=2321444874 Win=17520 Len=1460 [TCP PDU reassembled in 144]
140	10.202627	192.168.1.164	142.104.5.64	TCP	54	1201 → 80 [ACK] Seq=2321444874 Ack=2819860465 Win=17520 Len=0
141	10.208745	142.104.5.64	192.168.1.164	TCP	1514	80 → 1201 [ACK] Seq=2819860465 Ack=2321444874 Win=17520 Len=1460 [TCP PDU reassembled in 144]
142	10.210564	142.104.5.64	192.168.1.164	TCP	1514	80 → 1201 [ACK] Seq=2819861925 Ack=2321444874 Win=17520 Len=1460 [TCP PDU reassembled in 144]
143	10.210579	192.168.1.164	142.104.5.64	TCP	54	1201 → 80 [ACK] Seq=2321444874 Ack=2819863385 Win=17520 Len=0
144	10.211559	142.104.5.64	192.168.1.164	HTTP	1026	HTTP/1.1 200 OK  (JPEG JFIF image)
145	10.334044	192.168.1.164	142.104.5.64	TCP	54	1201 → 80 [ACK] Seq=2321444874 Ack=2819864357 Win=16548 Len=0
146	10.334087	192.168.1.164	142.104.5.64	TCP	54	1200 → 80 [ACK] Seq=2187556426 Ack=625971294 Win=16787 Len=0
147	22.154157	192.168.1.164	142.104.5.64	HTTP	505	GET /academic/faculties.html HTTP/1.1 
148	22.166927	142.104.5.64	192.168.1.164	TCP	1514	80 → 1200 [ACK] Seq=625971294 Ack=2187556877 Win=17520 Len=1460 [TCP PDU reassembled in 189]
149	22.168423	142.104.5.64	192.168.1.164	TCP	1514	80 → 1200 [ACK] Seq=625972754 Ack=2187556877 Win=17520 Len=1460 [TCP PDU reassembled in 189]
150	22.168450	192.168.1.164	142.104.5.64	TCP	54	1200 → 80 [ACK] Seq=2187556877 Ack=625974214 Win=17520 Len=0
151	22.169877	142.104.5.64	192.168.1.164	TCP	1514	80 → 1200 [ACK] Seq=625974214 Ack=2187556877 Win=17520 Len=1460 [TCP PDU reassembled in 189]
152	22.171638	142.104.5.64	192.168.1.164	TCP	1514	80 → 1200 [ACK] Seq=625975674 Ack=2187556877 Win=17520 Len=1460 [TCP PDU reassembled in 189]
153	22.171664	192.168.1.164	142.104.5.64	TCP	54	1200 → 80 [ACK] Seq=2187556877 Ack=625977134 Win=17520 Len=0
154	22.173079	142.104.5.64	192.168.1.164	TCP	1514	80 → 1200 [ACK] Seq=625977134 Ack=2187556877 Win=17520 Len=1460 [TCP PDU reassembled in 189]
155	22.174899	142.104.5.64	192.168.1.164	TCP	1514	80 → 1200 [ACK] Seq=625978594 Ack=2187556877 Win=17520 Len=1460 [TCP PDU reassembled in 189]
156	22.174925	192.168.1.164	142.104.5.64	TCP	54	1200 → 80 [ACK] Seq=2187556877 Ack=625980054 Win=17520 Len=0
157	22.176301	142.104.5.64	192.168.1.164	TCP	1514	80 → 1200 [ACK] Seq=625980054 Ack=2187556877 Win=17520 Len=1460 [TCP PDU reassembled in 189]
158	22.177675	142.104.5.64	192.168.1.164	TCP	1514	80 → 1200 [ACK] Seq=625981514 Ack=2187556877 Win=17520 Len=1460 [TCP PDU reassembled in 189]
159	22.177701	192.168.1.164	142.104.5.64	TCP	54	1200 → 80 [ACK] Seq=2187556877 Ack=625982974 Win=17520 Len=0
160	22.179460	142.104.5.64	192.168.1.164	TCP	1514	80 → 1200 [ACK] Seq=625982974 Ack=2187556877 Win=17520 Len=1460 [TCP PDU reassembled in 189]
161	22.180836	142.104.5.64	192.168.1.164	TCP	1514	80 → 1200 [ACK] Seq=625984434 Ack=2187556877 Win=17520 Len=1460 [TCP PDU reassembled in 189]
162	22.180861	192.168.1.164	142.104.5.64	TCP	54	1200 → 80 [ACK] Seq=2187556877 Ack=625985894 Win=17520 Len=0
163	22.182561	142.104.5.64	192.168.1.164	TCP	1514	80 → 1200 [ACK] Seq=625985894 Ack=2187556877 Win=17520 Len=1460 [TCP PDU reassembled in 189]
164	22.182593	192.168.1.164	142.104.5.64	TCP	54	1200 → 80 [ACK] Seq=2187556877 Ack=625987354 Win=17520 Len=0
165	22.183977	142.104.5.64	192.168.1.164	TCP	1514	80 → 1200 [PSH, ACK] Seq=625987354 Ack=2187556877 Win=17520 Len=1460 [TCP PDU reassembled in 189]
166	22.187916	142.104.5.64	192.168.1.164	TCP	1514	80 → 1200 [ACK] Seq=625988814 Ack=2187556877 Win=17520 Len=1460 [TCP PDU reassembled in 189]
167	22.187944	192.168.1.164	142.104.5.64	TCP	54	1200 → 80 [ACK] Seq=2187556877 Ack=625990274 Win=17520 Len=0
168	22.190669	142.104.5.64	192.168.1.164	TCP	1514	80 → 1200 [ACK] Seq=625990274 Ack=2187556877 Win=17520 Len=1460 [TCP PDU reassembled in 189]
169	22.200344	142.104.5.64	192.168.1.164	TCP	1514	80 → 1200 [ACK] Seq=625991734 Ack=2187556877 Win=17520 Len=1460 [TCP PDU reassembled in 189]
170	22.200395	192.168.1.164	142.104.5.64	TCP	54	1200 → 80 [ACK] Seq=2187556877 Ack=625993194 Win=17520 Len=0
171	22.201832	142.104.5.64	192.168.1.164	TCP	1514	80 → 1200 [ACK] Seq=625993194 Ack=2187556877 Win=17520 Len=1460 [TCP PDU reassembled in 189]
172	22.203571	142.104.5.64	192.168.1.164	TCP	1514	80 → 1200 [ACK] Seq=625994654 Ack=2187556877 Win=17520 Len=1460 [TCP PDU reassembled in 189]
173	22.203590	192.168.1.164	142.104.5.64	TCP	54	1200 → 80 [ACK] Seq=2187556877 Ack=625996114 Win=17520 Len=0
174	22.204970	142.104.5.64	192.168.1.164	TCP	1514	80 → 1200 [PSH, ACK] Seq=625996114 Ack=2187556877 Win=17520 Len=1460 [TCP PDU reassembled in 189]
175	22.206729	142.104.5.64	192.168.1.164	TCP	1514	80 → 1200 [ACK] Seq=625997574 Ack=2187556877 Win=17520 Len=1460 [TCP PDU reassembled in 189]
176	22.206748	192.168.1.164	142.104.5.64	TCP	54	1200 → 80 [ACK] Seq=2187556877 Ack=625999034 Win=17520 Len=0
177	22.208128	142.104.5.64	192.168.1.164	TCP	1514	80 → 1200 [ACK] Seq=625999034 Ack=2187556877 Win=17520 Len=1460 [TCP PDU reassembled in 189]
178	22.211518	142.104.5.64	192.168.1.164	TCP	1514	80 → 1200 [ACK] Seq=626000494 Ack=2187556877 Win=17520 Len=1460 [TCP PDU reassembled in 189]
179	22.211540	192.168.1.164	142.104.5.64	TCP	54	1200 → 80 [ACK] Seq=2187556877 Ack=626001954 Win=17520 Len=0
180	22.213011	142.104.5.64	192.168.1.164	TCP	1514	80 → 1200 [PSH, ACK] Seq=626001954 Ack=2187556877 Win=17520 Len=1460 [TCP PDU reassembled in 189]
181	22.214485	142.104.5.64	192.168.1.164	TCP	989	80 → 1200 [PSH, ACK] Seq=626003414 Ack=2187556877 Win=17520 Len=935 [TCP PDU reassembled in 189]
182	22.214505	192.168.1.164	142.104.5.64	TCP	54	1200 → 80 [ACK] Seq=2187556877 Ack=626004349 Win=17520 Len=0
183	22.215833	142.104.5.64	192.168.1.164	TCP	1514	80 → 1200 [ACK] Seq=626004349 Ack=2187556877 Win=17520 Len=1460 [TCP PDU reassembled in 189]
184	22.217579	142.104.5.64	192.168.1.164	TCP	1514	80 → 1200 [ACK] Seq=626005809 Ack=2187556877 Win=17520 Len=1460 [TCP PDU reassembled in 189]
185	22.217600	192.168.1.164	142.104.5.64	TCP	54	1200 → 80 [ACK] Seq=2187556877 Ack=626007269 Win=17520 Len=0
186	22.219095	142.104.5.64	192.168.1.164	TCP	1514	80 → 1200 [ACK] Seq=626007269 Ack=2187556877 Win=17520 Len=1460 [TCP PDU reassembled in 189]
187	22.220857	142.104.5.64	192.168.1.164	TCP	1514	80 → 1200 [ACK] Seq=626008729 Ack=2187556877 Win=17520 Len=1460 [TCP PDU reassembled in 189]
188	22.220878	192.168.1.164	142.104.5.64	TCP	54	1200 → 80 [ACK] Seq=2187556877 Ack=626010189 Win=17520 Len=0
189	22.221250	142.104.5.64	192.168.1.164	HTTP	281	HTTP/1.1 200 OK  (text/html)
190	22.351323	192.168.1.164	142.104.5.64	TCP	54	1200 → 80 [ACK] Seq=2187556877 Ack=626010416 Win=17293 Len=0
191	26.506923	142.104.5.64	192.168.1.164	TCP	60	80 → 1201 [FIN, ACK] Seq=2819864357 Ack=2321444874 Win=17520 Len=0
192	26.506981	192.168.1.164	142.104.5.64	TCP	54	1201 → 80 [ACK] Seq=2321444874 Ack=2819864358 Win=16548 Len=0
193	26.788936	192.168.1.164	142.104.5.64	TCP	54	1201 → 80 [FIN, ACK] Seq=2321444874 Ack=2819864358 Win=16548 Len=0
194	26.790436	192.168.1.164	142.104.5.64	HTTP	490	GET /cosi HTTP/1.1 
195	26.791774	142.104.5.64	192.168.1.164	TCP	60	80 → 1201 [ACK] Seq=2819864358 Ack=2321444875 Win=17520 Len=0
196	26.797606	142.104.5.64	192.168.1.164	HTTP	520	HTTP/1.1 302 Found  (text/html)
197	26.854912	192.168.1.164	142.104.105.208	TCP	62	1202 → 80 [SYN] Seq=880489553 Win=16384 Len=0 MSS=1460 SACK_PERM
198	26.860757	142.104.105.208	192.168.1.164	TCP	62	80 → 1202 [SYN, ACK] Seq=3518490163 Ack=880489554 Win=5840 Len=0 MSS=1460 SACK_PERM
199	26.860779	192.168.1.164	142.104.105.208	TCP	54	1202 → 80 [ACK] Seq=880489554 Ack=3518490164 Win=17520 Len=0
200	26.860855	192.168.1.164	142.104.105.208	HTTP	490	GET / HTTP/1.1 
201	26.864799	142.104.105.208	192.168.1.164	TCP	60	80 → 1202 [ACK] Seq=3518490164 Ack=880489990 Win=6432 Len=0
202	26.958297	192.168.1.164	142.104.5.64	TCP	54	1200 → 80 [ACK] Seq=2187557313 Ack=626010882 Win=16827 Len=0
203	26.977591	142.104.105.208	192.168.1.164	TCP	1514	80 → 1202 [ACK] Seq=3518490164 Ack=880489990 Win=6432 Len=1460 [TCP PDU reassembled in 215]
204	26.979094	142.104.105.208	192.168.1.164	TCP	1514	80 → 1202 [ACK] Seq=3518491624 Ack=880489990 Win=6432 Len=1460 [TCP PDU reassembled in 215]
205	26.979115	192.168.1.164	142.104.105.208	TCP	54	1202 → 80 [ACK] Seq=880489990 Ack=3518493084 Win=17520 Len=0
206	26.985575	142.104.105.208	192.168.1.164	TCP	1514	80 → 1202 [ACK] Seq=3518493084 Ack=880489990 Win=6432 Len=1460 [TCP PDU reassembled in 215]
207	26.986954	142.104.105.208	192.168.1.164	TCP	1514	80 → 1202 [ACK] Seq=3518494544 Ack=880489990 Win=6432 Len=1460 [TCP PDU reassembled in 215]
208	26.986968	192.168.1.164	142.104.105.208	TCP	54	1202 → 80 [ACK] Seq=880489990 Ack=3518496004 Win=17520 Len=0
209	26.988369	142.104.105.208	192.168.1.164	TCP	1514	80 → 1202 [ACK] Seq=3518496004 Ack=880489990 Win=6432 Len=1460 [TCP PDU reassembled in 215]
210	26.992431	142.104.105.208	192.168.1.164	TCP	791	80 → 1202 [PSH, ACK] Seq=3518497464 Ack=880489990 Win=6432 Len=737 [TCP PDU reassembled in 215]
211	26.992461	192.168.1.164	142.104.105.208	TCP	54	1202 → 80 [ACK] Seq=880489990 Ack=3518498201 Win=17520 Len=0
212	27.022668	142.104.105.208	192.168.1.164	TCP	1514	80 → 1202 [ACK] Seq=3518498201 Ack=880489990 Win=6432 Len=1460 [TCP PDU reassembled in 215]
213	27.024162	142.104.105.208	192.168.1.164	TCP	1514	80 → 1202 [ACK] Seq=3518499661 Ack=880489990 Win=6432 Len=1460 [TCP PDU reassembled in 215]
214	27.024180	192.168.1.164	142.104.105.208	TCP	54	1202 → 80 [ACK] Seq=880489990 Ack=3518501121 Win=17520 Len=0
215	27.024830	142.104.105.208	192.168.1.164	HTTP	521	HTTP/1.1 200 OK  (text/html)
216	27.138116	192.168.1.164	142.104.105.208	HTTP	413	GET /css/toplevel.css HTTP/1.1 
217	27.141287	142.104.105.208	192.168.1.164	TCP	60	80 → 1202 [ACK] Seq=3518501588 Ack=880490349 Win=7504 Len=0
218	27.144847	142.104.105.208	192.168.1.164	TCP	326	80 → 1202 [PSH, ACK] Seq=3518501588 Ack=880490349 Win=7504 Len=272 [TCP PDU reassembled in 225]
219	27.144988	192.168.1.164	142.104.105.208	TCP	54	1202 → 80 [FIN, ACK] Seq=880490349 Ack=3518501860 Win=16781 Len=0
220	27.148109	142.104.105.208	192.168.1.164	TCP	1514	80 → 1202 [ACK] Seq=3518501860 Ack=880490349 Win=7504 Len=1460 [TCP PDU reassembled in 225]
221	27.148138	192.168.1.164	142.104.105.208	TCP	54	1202 → 80 [RST, ACK] Seq=880490350 Ack=3518503320 Win=0 Len=0
222	27.149563	142.104.105.208	192.168.1.164	TCP	1514	80 → 1202 [ACK] Seq=3518503320 Ack=880490349 Win=7504 Len=1460 [TCP PDU reassembled in 225]
223	27.150941	142.104.105.208	192.168.1.164	TCP	1514	80 → 1202 [ACK] Seq=3518504780 Ack=880490349 Win=7504 Len=1460 [TCP PDU reassembled in 225]
224	27.154401	142.104.105.208	192.168.1.164	TCP	1514	80 → 1202 [ACK] Seq=3518506240 Ack=880490350 Win=7504 Len=1460 [TCP PDU reassembled in 225]
225	27.154807	142.104.105.208	192.168.1.164	HTTP	267	HTTP/1.1 200 OK  (text/css)
226	27.155235	142.104.105.208	192.168.1.164	TCP	60	80 → 1202 [FIN, ACK] Seq=3518507913 Ack=880490350 Win=7504 Len=0
227	27.161723	192.168.1.164	142.104.105.208	TCP	62	1203 → 80 [SYN] Seq=465062254 Win=16384 Len=0 MSS=1460 SACK_PERM
228	27.164948	142.104.105.208	192.168.1.164	TCP	62	80 → 1203 [SYN, ACK] Seq=3515230324 Ack=465062255 Win=5840 Len=0 MSS=1460 SACK_PERM
229	27.164968	192.168.1.164	142.104.105.208	TCP	54	1203 → 80 [ACK] Seq=465062255 Ack=3515230325 Win=17520 Len=0
230	27.165036	192.168.1.164	142.104.105.208	HTTP	413	GET /css/red_theme.css HTTP/1.1 
231	27.168746	142.104.105.208	192.168.1.164	TCP	60	80 → 1203 [ACK] Seq=3515230325 Ack=465062614 Win=6432 Len=0
232	27.172343	142.104.105.208	192.168.1.164	TCP	325	80 → 1203 [PSH, ACK] Seq=3515230325 Ack=465062614 Win=6432 Len=271 [TCP PDU reassembled in 234]
233	27.172424	192.168.1.164	142.104.105.208	TCP	54	1203 → 80 [FIN, ACK] Seq=465062614 Ack=3515230596 Win=17249 Len=0
234	27.174183	142.104.105.208	192.168.1.164	HTTP	917	HTTP/1.1 200 OK  (text/css)
235	27.174226	192.168.1.164	142.104.105.208	TCP	54	1203 → 80 [RST, ACK] Seq=465062615 Ack=3515231459 Win=0 Len=0
236	27.174667	192.168.1.164	142.104.105.208	TCP	62	1204 → 80 [SYN] Seq=4127936131 Win=16384 Len=0 MSS=1460 SACK_PERM
237	27.175729	142.104.105.208	192.168.1.164	TCP	60	80 → 1203 [FIN, ACK] Seq=3515231459 Ack=465062615 Win=6432 Len=0
238	27.177307	142.104.105.208	192.168.1.164	TCP	62	80 → 1204 [SYN, ACK] Seq=3525485541 Ack=4127936132 Win=5840 Len=0 MSS=1460 SACK_PERM
239	27.177326	192.168.1.164	142.104.105.208	TCP	54	1204 → 80 [ACK] Seq=4127936132 Ack=3525485542 Win=17520 Len=0
240	27.177393	192.168.1.164	142.104.105.208	HTTP	421	GET /images/uvic_4_csc_alt.gif HTTP/1.1 
241	27.180761	142.104.105.208	192.168.1.164	TCP	60	80 → 1204 [ACK] Seq=3525485542 Ack=4127936499 Win=6432 Len=0
242	27.184339	142.104.105.208	192.168.1.164	TCP	327	80 → 1204 [PSH, ACK] Seq=3525485542 Ack=4127936499 Win=6432 Len=273 [TCP PDU reassembled in 246]
243	27.184421	192.168.1.164	142.104.105.208	TCP	54	1204 → 80 [FIN, ACK] Seq=4127936499 Ack=3525485815 Win=17247 Len=0
244	27.187590	142.104.105.208	192.168.1.164	TCP	1514	80 → 1204 [ACK] Seq=3525485815 Ack=4127936499 Win=6432 Len=1460 [TCP PDU reassembled in 246]
245	27.187612	192.168.1.164	142.104.105.208	TCP	54	1204 → 80 [RST, ACK] Seq=4127936500 Ack=3525487275 Win=0 Len=0
246	27.188311	142.104.105.208	192.168.1.164	HTTP	616	HTTP/1.1 200 OK  (GIF89a)
247	27.188983	142.104.105.208	192.168.1.164	TCP	60	80 → 1204 [FIN, ACK] Seq=3525487837 Ack=4127936500 Win=6432 Len=0
248	27.210152	192.168.1.164	142.104.105.208	TCP	62	1205 → 80 [SYN] Seq=4250438591 Win=16384 Len=0 MSS=1460 SACK_PERM
249	27.212861	142.104.105.208	192.168.1.164	TCP	62	80 → 1205 [SYN, ACK] Seq=3518011504 Ack=4250438592 Win=5840 Len=0 MSS=1460 SACK_PERM
250	27.212886	192.168.1.164	142.104.105.208	TCP	54	1205 → 80 [ACK] Seq=4250438592 Ack=3518011505 Win=17520 Len=0
251	27.212967	192.168.1.164	142.104.105.208	HTTP	420	GET /images/banner01_alt.jpg HTTP/1.1 
252	27.216263	142.104.105.208	192.168.1.164	TCP	60	80 → 1205 [ACK] Seq=3518011505 Ack=4250438958 Win=6432 Len=0
253	27.220350	142.104.105.208	192.168.1.164	TCP	329	80 → 1205 [PSH, ACK] Seq=3518011505 Ack=4250438958 Win=6432 Len=275
254	27.220436	192.168.1.164	142.104.105.208	TCP	54	1205 → 80 [FIN, ACK] Seq=4250438958 Ack=3518011780 Win=17245 Len=0
255	27.228081	142.104.105.208	192.168.1.164	TCP	1514	80 → 1205 [ACK] Seq=3518011780 Ack=4250438958 Win=6432 Len=1460
256	27.228109	192.168.1.164	142.104.105.208	TCP	54	1205 → 80 [RST, ACK] Seq=4250438959 Ack=3518013240 Win=0 Len=0
257	27.229455	142.104.105.208	192.168.1.164	TCP	1514	80 → 1205 [ACK] Seq=3518013240 Ack=4250438959 Win=6432 Len=1460
258	27.230399	192.168.1.164	142.104.105.208	TCP	62	1206 → 80 [SYN] Seq=4021481080 Win=16384 Len=0 MSS=1460 SACK_PERM
259	27.230774	192.168.1.164	142.104.105.208	TCP	62	1207 → 80 [SYN] Seq=1666631993 Win=16384 Len=0 MSS=1460 SACK_PERM
260	27.233232	142.104.105.208	192.168.1.164	TCP	1514	80 → 1205 [ACK] Seq=3518014700 Ack=4250438959 Win=6432 Len=1460
261	27.236691	142.104.105.208	192.168.1.164	TCP	62	80 → 1206 [SYN, ACK] Seq=3517741318 Ack=4021481081 Win=5840 Len=0 MSS=1460 SACK_PERM
262	27.236752	192.168.1.164	142.104.105.208	TCP	54	1206 → 80 [ACK] Seq=4021481081 Ack=3517741319 Win=17520 Len=0
263	27.236879	192.168.1.164	142.104.105.208	HTTP	419	GET /images/dept_csc_alt.gif HTTP/1.1 
264	27.237054	142.104.105.208	192.168.1.164	TCP	62	80 → 1207 [SYN, ACK] Seq=3512765934 Ack=1666631994 Win=5840 Len=0 MSS=1460 SACK_PERM
265	27.237073	192.168.1.164	142.104.105.208	TCP	54	1207 → 80 [ACK] Seq=1666631994 Ack=3512765935 Win=17520 Len=0
266	27.237134	192.168.1.164	142.104.105.208	HTTP	332	GET /assets/images/span.gif HTTP/1.1 
267	27.240333	142.104.105.208	192.168.1.164	TCP	60	80 → 1206 [ACK] Seq=3517741319 Ack=4021481446 Win=6432 Len=0
268	27.241372	142.104.105.208	192.168.1.164	TCP	60	80 → 1207 [ACK] Seq=3512765935 Ack=1666632272 Win=6432 Len=0
269	27.245793	142.104.105.208	192.168.1.164	TCP	327	80 → 1206 [PSH, ACK] Seq=3517741319 Ack=4021481446 Win=6432 Len=273 [TCP PDU reassembled in 273]
270	27.245975	192.168.1.164	142.104.105.208	TCP	54	1206 → 80 [FIN, ACK] Seq=4021481446 Ack=3517741592 Win=17247 Len=0
271	27.248725	142.104.105.208	192.168.1.164	TCP	1514	80 → 1206 [ACK] Seq=3517741592 Ack=4021481446 Win=6432 Len=1460 [TCP PDU reassembled in 273]
272	27.248762	192.168.1.164	142.104.105.208	TCP	54	1206 → 80 [RST, ACK] Seq=4021481447 Ack=3517743052 Win=0 Len=0
273	27.249090	142.104.105.208	192.168.1.164	HTTP	147	HTTP/1.1 200 OK  (GIF89a)
274	27.250907	142.104.105.208	192.168.1.164	TCP	60	80 → 1206 [FIN, ACK] Seq=3517743145 Ack=4021481447 Win=6432 Len=0
275	27.279984	192.168.1.164	142.104.105.208	TCP	62	1208 → 80 [SYN] Seq=3889668270 Win=16384 Len=0 MSS=1460 SACK_PERM
276	27.284752	142.104.105.208	192.168.1.164	TCP	1514	80 → 1207 [ACK] Seq=3512765935 Ack=1666632272 Win=6432 Len=1460 [TCP PDU reassembled in 278]
277	27.285002	192.168.1.164	142.104.105.208	TCP	54	1207 → 80 [RST, ACK] Seq=1666632272 Ack=3512767395 Win=0 Len=0
278	27.286248	142.104.105.208	192.168.1.164	TCP	1514	HTTP/1.1 404 Not Found  [TCP PDU reassembled in 278]
279	27.287929	142.104.105.208	192.168.1.164	TCP	62	80 → 1208 [SYN, ACK] Seq=3516924063 Ack=3889668271 Win=5840 Len=0 MSS=1460 SACK_PERM
280	27.287957	192.168.1.164	142.104.105.208	TCP	54	1208 → 80 [ACK] Seq=3889668271 Ack=3516924064 Win=17520 Len=0
281	27.288044	192.168.1.164	142.104.105.208	HTTP	429	GET /news_photos/2004_07_15_hinf.jpg HTTP/1.1 
282	27.291828	142.104.105.208	192.168.1.164	TCP	60	80 → 1208 [ACK] Seq=3516924064 Ack=3889668646 Win=6432 Len=0
283	27.297927	142.104.105.208	192.168.1.164	TCP	330	80 → 1208 [PSH, ACK] Seq=3516924064 Ack=3889668646 Win=6432 Len=276
284	27.298287	192.168.1.164	142.104.105.208	TCP	54	1208 → 80 [FIN, ACK] Seq=3889668646 Ack=3516924340 Win=17244 Len=0
285	27.301173	142.104.105.208	192.168.1.164	TCP	1514	80 → 1208 [ACK] Seq=3516924340 Ack=3889668646 Win=6432 Len=1460
286	27.301221	192.168.1.164	142.104.105.208	TCP	54	1208 → 80 [RST, ACK] Seq=3889668647 Ack=3516925800 Win=0 Len=0
287	27.304634	142.104.105.208	192.168.1.164	TCP	1514	80 → 1208 [ACK] Seq=3516925800 Ack=3889668647 Win=6432 Len=1460
288	27.306088	142.104.105.208	192.168.1.164	TCP	1514	80 → 1208 [ACK] Seq=3516927260 Ack=3889668647 Win=6432 Len=1460
289	30.025742	192.168.1.164	142.104.105.208	TCP	62	1209 → 80 [SYN] Seq=1983232042 Win=16384 Len=0 MSS=1460 SACK_PERM
290	30.028751	142.104.105.208	192.168.1.164	TCP	62	80 → 1209 [SYN, ACK] Seq=3528334768 Ack=1983232043 Win=5840 Len=0 MSS=1460 SACK_PERM
291	30.028791	192.168.1.164	142.104.105.208	TCP	54	1209 → 80 [ACK] Seq=1983232043 Ack=3528334769 Win=17520 Len=0
292	30.028896	192.168.1.164	142.104.105.208	HTTP	492	GET /contacts/general.html HTTP/1.1 
293	30.033144	142.104.105.208	192.168.1.164	TCP	60	80 → 1209 [ACK] Seq=3528334769 Ack=1983232481 Win=6432 Len=0
294	30.041777	142.104.105.208	192.168.1.164	TCP	348	80 → 1209 [PSH, ACK] Seq=3528334769 Ack=1983232481 Win=6432 Len=294 [TCP PDU reassembled in 300]
295	30.044948	142.104.105.208	192.168.1.164	TCP	1514	80 → 1209 [ACK] Seq=3528335063 Ack=1983232481 Win=6432 Len=1460 [TCP PDU reassembled in 300]
296	30.044968	192.168.1.164	142.104.105.208	TCP	54	1209 → 80 [ACK] Seq=1983232481 Ack=3528336523 Win=17520 Len=0
297	30.050966	142.104.105.208	192.168.1.164	TCP	1514	80 → 1209 [ACK] Seq=3528336523 Ack=1983232481 Win=6432 Len=1460 [TCP PDU reassembled in 300]
298	30.052467	142.104.105.208	192.168.1.164	TCP	1514	80 → 1209 [ACK] Seq=3528337983 Ack=1983232481 Win=6432 Len=1460 [TCP PDU reassembled in 300]
299	30.052482	192.168.1.164	142.104.105.208	TCP	54	1209 → 80 [ACK] Seq=1983232481 Ack=3528339443 Win=17520 Len=0
300	30.053601	142.104.105.208	192.168.1.164	HTTP	1139	HTTP/1.1 200 OK  (text/html)
301	30.162551	192.168.1.164	142.104.105.208	TCP	54	1209 → 80 [ACK] Seq=1983232481 Ack=3528340528 Win=16435 Len=0
302	30.190078	192.168.1.164	142.104.105.208	HTTP	436	GET /css/blue_theme.css HTTP/1.1 
303	30.190784	192.168.1.164	142.104.105.208	TCP	62	1210 → 80 [SYN] Seq=1440039512 Win=16384 Len=0 MSS=1460 SACK_PERM
304	30.193815	142.104.105.208	192.168.1.164	TCP	62	80 → 1210 [SYN, ACK] Seq=3515860264 Ack=1440039513 Win=5840 Len=0 MSS=1460 SACK_PERM
305	30.193863	192.168.1.164	142.104.105.208	TCP	54	1210 → 80 [ACK] Seq=1440039513 Ack=3515860265 Win=17520 Len=0
306	30.193974	192.168.1.164	142.104.105.208	HTTP	353	GET /assets/images/span.gif HTTP/1.1 
307	30.197251	142.104.105.208	192.168.1.164	TCP	324	80 → 1209 [PSH, ACK] Seq=3528340528 Ack=1983232863 Win=7504 Len=270 [TCP PDU reassembled in 308]
308	30.198828	142.104.105.208	192.168.1.164	HTTP	917	HTTP/1.1 200 OK  (text/css)
309	30.198848	192.168.1.164	142.104.105.208	TCP	54	1209 → 80 [ACK] Seq=1983232863 Ack=3528341661 Win=17520 Len=0
310	30.199196	142.104.105.208	192.168.1.164	TCP	60	80 → 1210 [ACK] Seq=3515860265 Ack=1440039812 Win=6432 Len=0
311	30.242205	142.104.105.208	192.168.1.164	TCP	1514	80 → 1210 [ACK] Seq=3515860265 Ack=1440039812 Win=6432 Len=1460 [TCP PDU reassembled in 313]
312	30.243068	192.168.1.164	142.104.105.208	TCP	54	1210 → 80 [RST, ACK] Seq=1440039812 Ack=3515861725 Win=0 Len=0
313	30.243599	142.104.105.208	192.168.1.164	TCP	1514	HTTP/1.1 404 Not Found  [TCP PDU reassembled in 313]
314	33.782715	192.168.1.164	142.104.105.208	HTTP	332	GET /assets/images/span.gif HTTP/1.1 
315	33.830696	142.104.105.208	192.168.1.164	TCP	60	80 → 1209 [ACK] Seq=3528341661 Ack=1983233141 Win=8576 Len=0
316	33.837931	142.104.105.208	192.168.1.164	TCP	1514	80 → 1209 [ACK] Seq=3528341661 Ack=1983233141 Win=8576 Len=1460 [TCP PDU reassembled in 318]
317	33.838311	192.168.1.164	142.104.105.208	TCP	54	1209 → 80 [RST, ACK] Seq=1983233141 Ack=3528343121 Win=0 Len=0
318	33.839340	142.104.105.208	192.168.1.164	TCP	1514	HTTP/1.1 404 Not Found  [TCP PDU reassembled in 318]
319	39.279150	192.168.1.164	142.104.105.208	TCP	62	1211 → 80 [SYN] Seq=4034859610 Win=16384 Len=0 MSS=1460 SACK_PERM
320	39.307521	142.104.105.208	192.168.1.164	TCP	62	80 → 1211 [SYN, ACK] Seq=3532602802 Ack=4034859611 Win=5840 Len=0 MSS=1460 SACK_PERM
321	39.307560	192.168.1.164	142.104.105.208	TCP	54	1211 → 80 [ACK] Seq=4034859611 Ack=3532602803 Win=17520 Len=0
322	39.308948	192.168.1.164	142.104.105.208	HTTP	493	GET /pds/category.php?cat=1 HTTP/1.1 
323	39.403104	142.104.105.208	192.168.1.164	TCP	60	80 → 1211 [ACK] Seq=3532602803 Ack=4034860050 Win=6432 Len=0
324	39.563218	142.104.105.208	192.168.1.164	TCP	1514	80 → 1211 [ACK] Seq=3532602803 Ack=4034860050 Win=6432 Len=1460 [TCP PDU reassembled in 341]
325	39.564625	142.104.105.208	192.168.1.164	TCP	1514	80 → 1211 [ACK] Seq=3532604263 Ack=4034860050 Win=6432 Len=1460 [TCP PDU reassembled in 341]
326	39.564654	192.168.1.164	142.104.105.208	TCP	54	1211 → 80 [ACK] Seq=4034860050 Ack=3532605723 Win=17520 Len=0
327	39.570231	142.104.105.208	192.168.1.164	TCP	1514	80 → 1211 [ACK] Seq=3532605723 Ack=4034860050 Win=6432 Len=1460 [TCP PDU reassembled in 341]
328	39.571662	142.104.105.208	192.168.1.164	TCP	1514	80 → 1211 [ACK] Seq=3532607183 Ack=4034860050 Win=6432 Len=1460 [TCP PDU reassembled in 341]
329	39.571688	192.168.1.164	142.104.105.208	TCP	54	1211 → 80 [ACK] Seq=4034860050 Ack=3532608643 Win=17520 Len=0
